{
  "$schema": "https://aoa-agents/schemas/agent_arena_eligibility_v1.json",
  "agent_id": "reviewer",
  "candidate_seats": {
    "boundary_challenger": false,
    "chronicler": false,
    "closer": false,
    "contestant": true,
    "executor": false,
    "judge": false,
    "skeptic": true,
    "summon_initiator": false,
    "verifier": true,
    "witness": true
  },
  "eligibility_status": "candidate",
  "forbidden_seats": [
    "summon_initiator",
    "closer",
    "protocol_sovereign",
    "tree_promoter"
  ],
  "not_live_authority": true,
  "notes": [
    "May contest readiness, evidence sufficiency, and contradiction visibility under future charter.",
    "May witness evidence posture but cannot issue protocol verdicts in Agonic Actor Rechartering."
  ],
  "profile_id": "AOA-A-0003",
  "requires_center_charter": true
}
